<!ELEMENT catenemontuose (catenamontuosa*)>
<!ELEMENT catenamontuosa (nombre,monte+)>
<!ELEMENT monte (nome, regione?, altezza?)>
<!ELEMENT nome (#PCDATA)>
<!ELEMENT regione (#PCDATA)>
<!ELEMENT altezza (#PCDATA)>
<!ATTLIST altezza unitamisura CDATA #REQUIRED>
